<?xml version="1.0" encoding="UTF-8"?>
<messages xmlns:xsi="http://www.w3.org/2001/XMLSchema-instance" xsi:noNamespaceSchemaLocation="schema.xsd" package="com.dukascopy.dds3.transport.msg.types">

	<enum class="OrderSide" values="BUY, SELL" />
	<enum class="OrderState" values="CREATED, PENDING, EXECUTING, FILLED, REJECTED, CANCELLED, ERROR" />
	<enum class="OfferSide" values="ASK, BID" />
	<enum class="TimeInForce" values="IOC, GTC, FOK" />
	<enum class="TradabilityState" values="TRADING_ALLOWED, TRADING_TEMPORARY_BLOCKED, TRADING_RESTRICTED" />
	<enum class="RejectReason" values="INVALID_ORDER, SERVICE_OFFILNE, EXECUTION_RESTRICTED, STALE_PRICE, REJECTED_BY_COUNTERPARTY" />
    <enum class="SqlAction" values="EXECUTE, SELECT" />
    <enum class="AccountState" values="OK, MARGIN_CLOSING, MARGIN_CALL, OK_NO_MARGIN_CALL, DISABLED, BLOCKED" />
    <enum class="OrderDirection" values="OPEN, CLOSE" />
    <enum class="StopDirection" values="GREATER_BID,GREATER_ASK,LESS_BID,LESS_ASK"/>
    <enum class="CustRejectReason" values="MARGIN, LIQUIDITY, ERROR, INVALID_ORDER, CONNECTION" />
    <enum class="PositionSide" values="LONG, SHORT" />
    <enum class="PositionStatus" values="OPEN, CLOSE" />
    <enum class="NotificationMessageCode" values="SYSTEM_UNAVAILABLE, ACCOUNT_BLOCKED, ACCOUNT_BLOCKED_CLOSED, MERGE_IN_PROGRESS, NO_ORDER_FOUND, VALIDATION_ERROR, UPDATE_ORDER_NOT_FOUND, ORDER_ALREADY_FILLED, ORDER_IN_EXEC_STATE, ORDER_IN_ERROR_STATE, ORDER_FILLED, ORDER_FILLED_PARTIALLY, REJECTED_COUNTERPARTY, REJECT_AND_RESUBMIT, MAX_SUBMIT_COUNT_REACHED, MC_NOT_RESUBMIT, REJECT_INVALID_ORDER, REJECT_NO_MARGIN, FAILED_CANCEL_OFFER, FAILED_EDIT_OFFER, REJECTED_MIN_OPEN_AMOUNT, AMOUNT_GREATER_REMAINING, UNSUFFICIENT_MARGIN, CANCELING_OFFER_MC, EQUITY_LIMIT_REACHED, OFFER_CANCELED, OFFER_CANCELED_FILLED, OFFER_CANCELED_LEVERAGE, ORDER_CANCELED, SL_TP_DISABLED_NONHADGE, AMOUNT_EMPTY_OR_ZERO, PRICE_STOP_INVALID, STEP_LESS_3PIP, PRICE_CLIENT_EMPTY, AMOUNT_TO_LARGE, INSTRUMENT_EMPTY, ORDER_DIRECTION_EMPTY, ORDER_STATE_EMPTY, ORDER_SIDE_EMPTY, INVALID_ORDER, GROUP_MISSED, ORDER_NOT_FOUND, ACCOUNT_DISABLED, MAS_CLOSE_FAIL_BAD_ORDER, UNSUFF_MARGIN_ON_CLOSE, POSITION_MERGED_CLOSED, POSITION_MERGED_TO, POSITION_MERGE_FAILED, ACCOUNT_SETTING_SAVE_FAIL, STRING_MESSAGE, OCO_GROUPED, OCO_UNGROUPED, MC_MARGIN_CUT_WEEKEND, MC_MARGIN_CUT, ACCOUNT_STATUS_DISABLED, POSITION_LIMIT_REACHED, NEWS_REQUEST_LIMIT_EXCEEDED, ORDER_ACCEPTED, MULTIPLE_SIM_ORDERED, ACCOUNT_LOCKED, NO_MARGIN_LEVEL, MERGE_DENIED, CONDITION_CHANGED, DEACT_CLIENT_DLL_ST, DEACT_CLIENT_DLL_MC, DEACT_CLIENT_LL_ST, DEACT_CLIENT_LL_MC, DEACT_CLIENT_OTHER, ALREADY_PROCESSED, POSITION_LIMIT, SYSTEM_ERROR, ORDER_LOCKED, TRALING_UPDATE, CONTEST_OVER, WITHDRAWAL_DIONE, MC_CLOSING" />
    <enum class="NotificationLevel" values="INFO, WARNING, ALERT, ERROR, INFOCLIENT, NOTIFCLIENT"/>
	<enum class="TaskStatus" values="STARTED, IN_PROGRESS, FINISHED" />
	<enum class="FundRatioChangeStatus" values="OK, ERROR" />
	<enum class="DataFormat" values="CSV, CHART" />
</messages>
